{
  "artifact_sha256": "nM9rCezdJzoRnrQ8iTYpEqgkG4o-oWuu3YRV8spf-jg",
  "files": [
    {
      "path": "LICENSE",
      "sha256": "xx0jnfkXJvxRnG63LTGOxlggYnIysveWIZ6H3PNdCrQ"
    },
    {
      "path": "NOTICE",
      "sha256": "gQ36z1LGXdBTfxIY68QuW4dHcNZCvLwgeXand08cZYg"
    },
    {
      "path": "agent_core/__init__.py",
      "sha256": "y3snwf1Ab5OI_ueQg-RdsGFWkDnQkD6UXTuZQ_cGow8"
    },
    {
      "path": "agent_core/candidates.py",
      "sha256": "P97vR9p2vea7qKzpcaWbOvTLoIlw4DEKyr65Qma1pRc"
    },
    {
      "path": "agent_core/capture.py",
      "sha256": "ZPDjLrAFo_UFbcBxepM47CkK2SrWzDqpzBU1hketo8o"
    },
    {
      "path": "agent_core/cli.py",
      "sha256": "ihUM0YswyDZNx3r0whQC_aSbYQ_-ooYZcDenEwJIR4M"
    },
    {
      "path": "agent_core/config.py",
      "sha256": "9CFJR5dTpIUk6m2InbT1ohVqu1Jo6oDfov8U0yyen7A"
    },
    {
      "path": "agent_core/doctor.py",
      "sha256": "MrPj6AQfXpatCYqad9hhcJoUi9K6NsUSbY2va-kMRkg"
    },
    {
      "path": "agent_core/freshness.py",
      "sha256": "GEBzFYBWl1kHO3UYVx6MNwGQJIy29gNudLlByfLYFBc"
    },
    {
      "path": "agent_core/installer.py",
      "sha256": "6RJ3DoTPsyWKVtBL_9EIX0T6hGB3eOb_FprqAhDJSEw"
    },
    {
      "path": "agent_core/launcher.py",
      "sha256": "kyyaSQlhCDjIvW_ec1EwU4XLgYy-QrmMUdrlZw0hbf0"
    },
    {
      "path": "agent_core/ledger.py",
      "sha256": "bTp92mrXScZNHQ_SgDPdDiHd0qcpq77DQu29BGLivow"
    },
    {
      "path": "agent_core/local_promote.py",
      "sha256": "NZBd8rGrDw0sksP2EBL70YPuy-OOND23VHzPjW_jzaE"
    },
    {
      "path": "agent_core/lock.py",
      "sha256": "5FEQ88mcaftxh5OgmeLbyW0cUkAvJf7WygVSz__SrFE"
    },
    {
      "path": "agent_core/match.py",
      "sha256": "Ub-PR_3sG7AqC9lUzdS0yq7b8rppEPVBesDlliNIDyA"
    },
    {
      "path": "agent_core/materializer.py",
      "sha256": "3ckQ9dhNsktl6mrzNyqkw2Fq5BI_UvsdL_qH7CJ9nFc"
    },
    {
      "path": "agent_core/privacy.py",
      "sha256": "_ziGtQ4Pu3ImqQushPHiSOczXyAFeMt_kGkfLrFlMRY"
    },
    {
      "path": "agent_core/project.py",
      "sha256": "SNTAHb8dYSNlkqJXDgnDsVmu711FViiErYc1PcH3Qh8"
    },
    {
      "path": "agent_core/project_promote.py",
      "sha256": "vdAz-LkEbFE51b_Mss8Qae9Hi3P9T_Eg7EPnrG8gzFY"
    },
    {
      "path": "agent_core/provenance.py",
      "sha256": "B7O3tjLn3K9SL2VVw8xd26FtWPaJ_z0Z0piJnVswQpY"
    },
    {
      "path": "agent_core/reject.py",
      "sha256": "aUUjToYXh3TSWDNWRlgwnOUiieqnHq8-wYDqNljl1dY"
    },
    {
      "path": "agent_core/repository.py",
      "sha256": "g_f87RtzGCTHLc0FfDnIbNZd5VNsFDaqnngBJQjFLhs"
    },
    {
      "path": "agent_core/retire.py",
      "sha256": "wDr2aEgzWo7avk61ZpS-uigcD-1ATILojV3m-10Mnzo"
    },
    {
      "path": "agent_core/runtime_config.py",
      "sha256": "PPXus9mxxx54O5D53DXzyPMLiNET09otKIvdINBy8t8"
    },
    {
      "path": "agent_core/schema/agent-core-lock-1.json",
      "sha256": "tC0Ljods_tyCBi9NuKQtuydPWzNFeBF0GY6VVqixmAY"
    },
    {
      "path": "agent_core/schema/agent-core.config-1.json",
      "sha256": "R97Ia_n0lqC37siGYNb6P0-pVDFyU1wJocPs8vZU1qQ"
    },
    {
      "path": "agent_core/schema/capability-manifest-1.json",
      "sha256": "m_9lGem0NBhKgAdjc5YpwjIvUH-jTiXvxaAkSMmk6WQ"
    },
    {
      "path": "agent_core/schema/engine-pin-1.json",
      "sha256": "Lc6HjLu_cZUUaHksYa3qIP8WiTG2wuGyg8IcAEGErYg"
    },
    {
      "path": "agent_core/schema/evidence-1.json",
      "sha256": "CGeorewsHBAXgjMXV3LcneWUA2SXyMGMc-3rDFnAfVg"
    },
    {
      "path": "agent_core/schema/install-receipt-1.json",
      "sha256": "dlHXw_vydIrIP51-2IOs5M_m2-uqhEB5tnj0OO5OdHQ"
    },
    {
      "path": "agent_core/schema/install-snapshot-1.json",
      "sha256": "tkDixaZhAmVXIbWsTEGR_SF7Neafbh6pGLpV1l8jpjA"
    },
    {
      "path": "agent_core/schema/lessons-hook-heartbeat-1.json",
      "sha256": "_9-zmAAflHaaVIbFgvuK_ADQsWM8nNOZm7w06vfS8tY"
    },
    {
      "path": "agent_core/schema/lessons-hook-heartbeat-2.json",
      "sha256": "dW_saAXh9riDQFqJXSDU_NycTwvxl8weQdrjYMWFiMg"
    },
    {
      "path": "agent_core/schema/lessons-ledger-2.json",
      "sha256": "_ns3sgFg3BtzjoOgmrla_GzR9l5lKaq3RgJEyvmrrjE"
    },
    {
      "path": "agent_core/schema/privacy-allowlist-1.json",
      "sha256": "9ZvM4DfPm1l6HdOrw7PhzokczRrpjrCU4IYEn2RbJVA"
    },
    {
      "path": "agent_core/schema/privacy-rules-1.json",
      "sha256": "aDs2FKoEbeLpl-5QqLgq5EWhrPmA7pb4f_V9ODlmgIM"
    },
    {
      "path": "agent_core/schema/publication-identity-1.json",
      "sha256": "U9yKXY4TGMHwDVeQhYvlr-_wcLDhfxwrR1ZNA1fCYJk"
    },
    {
      "path": "agent_core/schema/release-manifest-1.json",
      "sha256": "K-yZ9CClHmgWcLuRTJfNQOTIuzN89Jx0P59ZLl8vB_E"
    },
    {
      "path": "agent_core/schema/verifier-1.json",
      "sha256": "6srNIuvFCD3gvN3GlUXraPMBmNxPc8UrMhcpigb8gu0"
    },
    {
      "path": "agent_core/state.py",
      "sha256": "cbmDvtmjkYFBECO7_NvgIk4949Kn6ICkQrFoqqjpSYc"
    },
    {
      "path": "agent_core/stopwords.txt",
      "sha256": "Ixdv3ssyFprRlnmSpbWpNeNxazHbkTePaAhDzu9xc_I"
    },
    {
      "path": "agent_core/sync.py",
      "sha256": "YTKB4ESEOo5il0pa2u0816BhNXnPPzKOG6YEKOq4ppI"
    },
    {
      "path": "enforcement/check_active_ledger_roundtrip.py",
      "sha256": "Ql_8-1gNs0uVUIfNcpc3-W3j-0c5A0DkDUuoAjBfX1I"
    },
    {
      "path": "enforcement/verifiers.json",
      "sha256": "SLiSxFoPVBLDw4N_BV1_2-qAV2qi6Nh9mrZBXslQ-MI"
    },
    {
      "path": "examples/host.example.json",
      "sha256": "FQunaS7rmz-gF65K91Hk6K7SOPDX3gNUvRoctUaNd3U"
    },
    {
      "path": "examples/manifest.custom.example.yaml",
      "sha256": "cTEdwrydxA-F7hX4w8b7Z6MMJNQDoqhgBYVg4-tpp8o"
    },
    {
      "path": "examples/prepare_private.py",
      "sha256": "c9rrKRTnH69uiwuvveYP-FaKZJ_9eTucEltWAUla3xc"
    },
    {
      "path": "examples/rules.global.example.md",
      "sha256": "OXgezbTNmXfu3g_q4KozU5SWwbt-xQZG8oj5ja0VFbM"
    },
    {
      "path": "install.ps1",
      "sha256": "N6yw86EAxB1Wk_o23-1DEpPNon-JtvnZ6oLq6jw101w"
    },
    {
      "path": "install.sh",
      "sha256": "NGLJ99rynB2tlktQgp4Nv-fQpfSodbgggpNC_B36D7s"
    },
    {
      "path": "manifest.yaml",
      "sha256": "pwbTudOx7gWcMUB9v9hYVOG0E6LmVhKis0QGRVNFmrY"
    },
    {
      "path": "privacy_rules.default.json",
      "sha256": "_MGHZRcos_UTKKkRVLkmXH132bCoYtG-2X7K7_1MGmA"
    },
    {
      "path": "pyproject.toml",
      "sha256": "mVveTxe8OXmyUOp-yUwfWGXkqHy2tEmqTPVjifNWlbE"
    },
    {
      "path": "runtimes/claude-code/head.md",
      "sha256": "W1GIkeMOrkp_nM8Krq8HJ1hXWxn7aPK7XHbCfLkZRYE"
    },
    {
      "path": "runtimes/claude-code/hook.fragment.json",
      "sha256": "yrQETkA8egl6v6GoffCGn1Lrzg_6vP20YaP6mD8Oecw"
    },
    {
      "path": "runtimes/codex/head.md",
      "sha256": "eXU-qIlkcJxUGKfw0FPC99Jf-m9qi5hxAXhTAAYsYUo"
    },
    {
      "path": "runtimes/codex/hook.fragment.json",
      "sha256": "yrQETkA8egl6v6GoffCGn1Lrzg_6vP20YaP6mD8Oecw"
    },
    {
      "path": "runtimes/generic/head.md",
      "sha256": "ml72sd8_3VLaAeMpmeVsnLG-OSxuLKrIoEd6k1jmL2k"
    },
    {
      "path": "runtimes/generic/user_prompt.sh",
      "sha256": "BLBcWlRYA_dNMeopM1GIIXNSyooC9ni5rhoB4t6YOKo"
    },
    {
      "path": "seed/CASE_LAW.md",
      "sha256": "YW1LqswkzhcY8olkFI0-mwsiZRdb6kTJrMh_Cl2lSBI"
    },
    {
      "path": "seed/LESSONS.md",
      "sha256": "qHiXv5tcc7xiAv-UVPfOxG40Bm3UEcEK6GRuAi1XBl0"
    },
    {
      "path": "seed/profiles/example-domain/LESSONS.md",
      "sha256": "8ilOAqE21iN5mOv_AMWLV_4lMnjNzlKD-YW8d10P8fk"
    },
    {
      "path": "skills/adversarial-audit/SKILL.md",
      "sha256": "BtvqtRmk3ssAh5jcshwic-tJTvFS_sEFKgLPduIQSnI"
    },
    {
      "path": "skills/dispatching-task-cards/SKILL.md",
      "sha256": "GwgvMqoRkCuTSOEa5JrQAhfos673jj4Y0ChAmv-Z9QI"
    },
    {
      "path": "skills/first-divergence-debugging/SKILL.md",
      "sha256": "S9JKMxyGOI9g-a05hK3bpvGGAxJCLgQBE-jl8i6rgvo"
    },
    {
      "path": "templates/audit-checklist.md",
      "sha256": "ny4JvlTg7tg1U-vWUlM8e1Rb_ys8NhjQt0zooBg4SBg"
    },
    {
      "path": "templates/check_shared_literal.py",
      "sha256": "Xf3OoCac6q3qmmA5cCPAd9nJplSRwmyAWRPQiKoutfk"
    },
    {
      "path": "templates/check_shell_format.py",
      "sha256": "BU9AqStqwOsi26YcEWtaQnI9aIZu7uBoy2U9vWEjHdU"
    },
    {
      "path": "templates/fixtures/audit-checklist.invalid.md",
      "sha256": "UNlS7N1ghA0qvQKC5iq0bfub3OP1IyGtgEMO7kuvECs"
    },
    {
      "path": "templates/fixtures/literal-clean.txt",
      "sha256": "BiCfVTYjzsPpJH6lAvS1-lhwoBiL6y6DJ4iQYgOrF8M"
    },
    {
      "path": "templates/fixtures/literal-dirty.txt",
      "sha256": "apYZWAQKb1ZczbjYs7IY8iove6AhQqOvRpaJsn6wbhA"
    },
    {
      "path": "templates/fixtures/task-card.invalid.md",
      "sha256": "gWa68dXzt10A6Fpq6U-Ll6SC6QWmX8YVR4EvQk80I4I"
    },
    {
      "path": "templates/task-card.md",
      "sha256": "7xs-NxiKFTju9RfLabmFtuIXNEXlA0jtAPJoyMx-DRs"
    },
    {
      "path": "templates/verify_template.py",
      "sha256": "h_gj7p29kvOKBxWgN2EQxtmozlTOYKP5lTuIPKAVvHQ"
    }
  ],
  "schema": "release-manifest/1",
  "version": "0.2.0"
}
